{
    "name": "Kilo_Class_MVP",
    "type": "Submarine",
    "submarine_platform": {
        "submerged_displacement_kg": 3100000.0,
        "length_m": 73.8,
        "beam_m": 9.9,
        "draft_m": 6.2,
        "max_speed_submerged_mps": 10.5,
        "quiet_speed_mps": 4.5,
        "max_accel_mps2": 0.05,
        "max_decel_mps2": 0.08,
        "max_turn_rate_deg_s": 1.6,
        "max_depth_rate_mps": 3.0,
        "nominal_patrol_depth_m": 80.0,
        "max_operating_depth_m": 240.0,
        "acoustic_stealth_bias_db": -6.0,
        "self_noise_per_speed_db": 1.0,
        "crew": 52
    },
    "health": {
        "current_hp": 3100.0,
        "max_hp": 3100.0
    },
    "mounted_sonars": [
        {
            "label": "sub_passive_bow_sonar_mvp",
            "sonar": {
                "mode": "Passive",
                "max_range_m": 26000.0,
                "scan_period_s": 5.0,
                "detection_threshold_db": 6.0,
                "track_memory_s": 24.0,
                "bearing_noise_std_deg": 2.0,
                "range_noise_std_m": 700.0,
                "directivity_gain_db": 4.0,
                "self_noise_per_speed_db": 1.0,
                "ambient_noise_db": 70.0,
                "source_level_reference_db": 116.0,
                "source_level_speed_factor_db": 1.5,
                "transmission_loss_alpha_db_per_km": 0.08,
                "layer_break_penalty_db": 4.0,
                "baffle_exclusion_deg": 45.0,
                "ownship_quieting_speed_mps": 4.5,
                "confirm_hits_m": 2,
                "confirm_window_n": 3,
                "passive_only": true,
                "bearing_only": false
            }
        }
    ],
    "has_command_link": true,
    "command_link": {
        "latency_s": 0.2,
        "drop_prob": 0.0
    },
    "_provenance": {
        "modeling_note": "engineering calibration; community-derived approximation for a conventional diesel-electric submarine representative, not authoritative Kilo-class tactical data."
    }
}
